area,rank,title
Face Recognition,152,Improving the Fairness of Deep Generative Models without Retraining
Face Recognition,153,AdvFaces: Adversarial Face Synthesis
Face Recognition,154,Jointly De-biasing Face Recognition and Demographic Attribute Estimation
Face Recognition,155,Decorrelated Adversarial Learning for Age-Invariant Face Recognition
Face Recognition,156,Multimodal Task-Driven Dictionary Learning for Image Classification
Face Recognition,157,Face Manifold: Manifold Learning for Synthetic Face Generation
Face Recognition,158,BroadFace: Looking at Tens of Thousands of People at Once for Face Recognition
Face Recognition,159,Pose-Selective Max Pooling for Measuring Similarity
Face Recognition,160,Gotta Catch 'Em All: Using Honeypots to Catch Adversarial Attacks on Neural Networks
Face Recognition,161,Towards Interpretable Face Recognition
Face Recognition,162,Network Pruning using Adaptive Exemplar Filters
Face Recognition,163,Fast Geometrically-Perturbed Adversarial Faces
Face Recognition,164,CVAE-GAN: Fine-Grained Image Generation through Asymmetric Training
Face Recognition,165,Secure Face Matching Using Fully Homomorphic Encryption
Face Recognition,166,Deep Transferring Quantization
Face Recognition,167,GhostVLAD for set-based face recognition
Face Recognition,168,"Decoupling ""when to update"" from ""how to update"""
Face Recognition,169,PocketNet: Extreme Lightweight Face Recognition Network using Neural Architecture Search and Multi-Step Knowledge Distillation
Face Recognition,170,Unmasking Face Embeddings by Self-restrained Triplet Loss for Accurate Masked Face Recognition
Face Recognition,171,Intra-Processing Methods for Debiasing Neural Networks
Face Recognition,172,Additive Adversarial Learning for Unbiased Authentication
Face Recognition,173,Primal-Dual Algorithms for Non-negative Matrix Factorization with the Kullback-Leibler Divergence
Face Recognition,174,Kernel Principal Component Analysis and its Applications in Face Recognition and Active Shape Models
Face Recognition,175,Learnable Multi-level Frequency Decomposition and Hierarchical Attention Mechanism for Generalized Face Presentation Attack Detection
Face Recognition,176,Multi-Dataset Benchmarks for Masked Identification using Contrastive Representation Learning
Face Recognition,177,Does Generative Face Completion Help Face Recognition?
Face Recognition,178,A New Loss Function for CNN Classifier Based on Pre-defined Evenly-Distributed Class Centroids
Face Recognition,179,Improving Face Recognition with Large Age Gaps by Learning to Distinguish Children
Face Recognition,180,Dynamic Deep Multi-task Learning for Caricature-Visual Face Recognition
Face Recognition,181,Improving Collaborative Metric Learning with Efficient Negative Sampling
Face Recognition,182,Deep Anomaly Detection for Generalized Face Anti-Spoofing
Face Recognition,183,"A Comprehensive Performance Evaluation of Deformable Face Tracking ""In-the-Wild"""
Face Recognition,184,When Face Recognition Meets Occlusion: A New Benchmark
Face Recognition,185,A2-LINK: Recognizing Disguised Faces via Active Learning and Adversarial Noise based Inter-Domain Knowledge
Face Recognition,186,Towards Face Encryption by Generating Adversarial Identity Masks
Face Recognition,187,Algorithmic Discrimination: Formulation and Exploration in Deep Learning-based Face Biometrics
Face Recognition,188,A-LINK: Recognizing Disguised Faces via Active Learning based Inter-Domain Knowledge
Face Recognition,189,SensitiveNets: Learning Agnostic Representations with Application to Face Images
Face Recognition,190,Boosting Semi-Supervised Face Recognition with Noise Robustness
Face Recognition,191,Analysis and evaluation of Deep Learning based Super-Resolution algorithms to improve performance in Low-Resolution Face Recognition
Face Recognition,192,Adaptive Threshold for Online Object Recognition and Re-identification Tasks
Face Recognition,193,Cross-Domain Face Synthesis using a Controllable GAN
Face Recognition,194,Adv-Makeup: A New Imperceptible and Transferable Attack on Face Recognition
Face Recognition,195,Mind Your Weight(s): A Large-scale Study on Insufficient Machine Learning Model Protection in Mobile Apps
Face Recognition,196,Domain-Specific Face Synthesis for Video Face Recognition from a Single Sample Per Person
Face Recognition,197,Face Aging With Conditional Generative Adversarial Networks
Face Recognition,198,On Recognizing Occluded Faces in the Wild
Face Recognition,199,Virtual Fully-Connected Layer: Training a Large-Scale Face Recognition Dataset With Limited Computational Resources
Face Recognition,200,Superpixel-based Domain-Knowledge Infusion in Computer Vision
Depth Estimation,1,Unsupervised Learning of Depth and Ego-Motion from Monocular Video Using 3D Geometric Constraints
Depth Estimation,2,Depth Prediction Without the Sensors: Leveraging Structure for Unsupervised Learning from Monocular Videos
Depth Estimation,3,Unsupervised Monocular Depth Learning in Dynamic Scenes
Depth Estimation,4,Depth from Videos in the Wild: Unsupervised Monocular Depth Learning from Unknown Cameras
Depth Estimation,5,Learning Single Camera Depth Estimation using Dual-Pixels
Depth Estimation,6,A General and Adaptive Robust Loss Function
Depth Estimation,7,Learning to Navigate in Complex Environments
Depth Estimation,8,Two-stage Convolutional Part Heatmap Regression for the 1st 3D Face Alignment in the Wild (3DFAW) Challenge
Depth Estimation,9,Digging Into Self-Supervised Monocular Depth Estimation
Depth Estimation,10,Digging Into Self-Supervised Monocular Depth Estimation
Depth Estimation,11,Efficient Attention: Attention with Linear Complexities
Depth Estimation,12,Unsupervised Monocular Depth Estimation with Left-Right Consistency
Depth Estimation,13,Probabilistic and Geometric Depth: Detecting Objects in Perspective
Depth Estimation,14,Unsupervised Learning of Depth and Ego-Motion from Video
Depth Estimation,15,Atlas: End-to-End 3D Scene Reconstruction from Posed Images
Depth Estimation,16,3D Ken Burns Effect from a Single Image
Depth Estimation,17,Vision Transformers for Dense Prediction
Depth Estimation,18,Towards Robust Monocular Depth Estimation: Mixing Datasets for Zero-shot Cross-dataset Transfer
Depth Estimation,19,Consistent Video Depth Estimation
Depth Estimation,20,High Quality Monocular Depth Estimation via Transfer Learning
Depth Estimation,21,Pyramid Stereo Matching Network
Depth Estimation,22,Deeper Depth Prediction with Fully Convolutional Residual Networks
Depth Estimation,23,GIMP-ML: Python Plugins for using Computer Vision Models in GIMP
Depth Estimation,24,On the Importance of Stereo for Accurate Depth Estimation: An Efficient Semi-Supervised Deep Neural Network Approach
Depth Estimation,25,Sparse Auxiliary Networks for Unified Monocular Depth Prediction and Completion
Depth Estimation,26,Neural Ray Surfaces for Self-Supervised Learning of Depth and Ego-motion
Depth Estimation,27,Semantically-Guided Representation Learning for Self-Supervised Monocular Depth
Depth Estimation,28,3D Packing for Self-Supervised Monocular Depth Estimation
Depth Estimation,29,Pseudo-LiDAR from Visual Depth Estimation: Bridging the Gap in 3D Object Detection for Autonomous Driving
Depth Estimation,30,FastDepth: Fast Monocular Depth Estimation on Embedded Systems
Depth Estimation,31,Boosting Monocular Depth Estimation Models to High-Resolution via Content-Adaptive Multi-Resolution Merging
Depth Estimation,32,Geo-Supervised Visual Depth Prediction
Depth Estimation,33,MegaDepth: Learning Single-View Depth Prediction from Internet Photos
Depth Estimation,34,Unsupervised Scale-consistent Depth Learning from Video
Depth Estimation,35,Unsupervised Scale-consistent Depth and Ego-motion Learning from Monocular Video
Depth Estimation,36,DepthLab: Real-Time 3D Interaction With Depth Maps for Mobile Augmented Reality
Depth Estimation,37,Structured Knowledge Distillation for Dense Prediction
Depth Estimation,38,FSA-Net: Learning Fine-Grained Structure Aggregation for Head Pose Estimation From a Single Image
Depth Estimation,39,DeepV2D: Video to Depth with Differentiable Structure from Motion
Depth Estimation,40,Multi-Task Learning as Multi-Objective Optimization
Depth Estimation,41,Deep Depth Completion of a Single RGB-D Image
Depth Estimation,42,"Why Having 10,000 Parameters in Your Camera Model Is Better Than Twelve"
Depth Estimation,43,"Why Having 10,000 Parameters in Your Camera Model is Better Than Twelve"
Depth Estimation,44,Pseudo-LiDAR++: Accurate Depth for 3D Object Detection in Autonomous Driving
Depth Estimation,45,PLUMENet: Efficient 3D Object Detection from Stereo Images
Depth Estimation,46,StereoNet: Guided Hierarchical Refinement for Real-Time Edge-Aware Depth Prediction
Depth Estimation,47,Learning Depth with Convolutional Spatial Propagation Network
Depth Estimation,48,Depth Estimation via Affinity Learned with Convolutional Spatial Propagation Network
Depth Estimation,49,Deep Ordinal Regression Network for Monocular Depth Estimation
Depth Estimation,50,From Big to Small: Multi-Scale Local Planar Guidance for Monocular Depth Estimation
Depth Estimation,51,What Uncertainties Do We Need in Bayesian Deep Learning for Computer Vision?
Depth Estimation,52,"Competitive Collaboration: Joint Unsupervised Learning of Depth, Camera Motion, Optical Flow and Motion Segmentation"
Depth Estimation,53,Learning to Recover 3D Scene Shape from a Single Image
Depth Estimation,54,DiverseDepth: Affine-invariant Depth Prediction Using Diverse Data
Depth Estimation,55,Enforcing geometric constraints of virtual normal for depth prediction
Depth Estimation,56,Anytime Stereo Image Depth Estimation on Mobile Devices
Depth Estimation,57,PlaneNet: Piece-wise Planar Reconstruction from a Single RGB Image
Depth Estimation,58,Sparse-to-Dense: Depth Prediction from Sparse Depth Samples and a Single Image
Depth Estimation,59,Parse Geometry from a Line: Monocular Depth Estimation with Partial Laser Observation
Depth Estimation,60,Fast Robust Monocular Depth Estimation for Obstacle Detection with Fully Convolutional Networks
Depth Estimation,61,Continual Adaptation for Deep Stereo
Depth Estimation,62,Revisiting Stereo Depth Estimation From a Sequence-to-Sequence Perspective with Transformers
Depth Estimation,63,Index Network
Depth Estimation,64,Sparse and noisy LiDAR completion with RGB guidance and uncertainty
Depth Estimation,65,Sparse and noisy LiDAR completion with RGB guidance anduncertainty
Depth Estimation,66,AdaBins: Depth Estimation using Adaptive Bins
Depth Estimation,67,Unsupervised Learning of Monocular Depth Estimation and Visual Odometry with Deep Feature Reconstruction
Depth Estimation,68,Revisiting Single Image Depth Estimation: Toward Higher Resolution Maps with Accurate Object Boundaries
Depth Estimation,69,The Temporal Opportunist: Self-Supervised Multi-Frame Monocular Depth
Depth Estimation,70,Single View Stereo Matching
Depth Estimation,71,CNN-SVO: Improving the Mapping in Semi-Direct Visual Odometry Using Single-Image Depth Prediction
Depth Estimation,72,OmniDet: Surround View Cameras based Multi-task Visual Perception Network for Autonomous Driving
Depth Estimation,73,"WoodScape: A multi-task, multi-camera fisheye dataset for autonomous driving"
Depth Estimation,74,Softmax Splatting for Video Frame Interpolation
Depth Estimation,75,Learning Stereo from Single Images
Depth Estimation,76,MVDepthNet: Real-time Multiview Depth Estimation Neural Network
Depth Estimation,77,Self-supervised 3D Representation Learning of Dressed Humans from Social Media Videos
Depth Estimation,78,Self-Supervised Monocular 3D Face Reconstruction by Occlusion-Aware Multi-view Geometry Consistency
Depth Estimation,79,Understanding Contrastive Representation Learning through Geometry on the Hypersphere
Depth Estimation,80,MonoGRNet: A Geometric Reasoning Network for Monocular 3D Object Localization
Depth Estimation,81,Unsupervised CNN for Single View Depth Estimation: Geometry to the Rescue
Depth Estimation,82,A2J: Anchor-to-Joint Regression Network for 3D Articulated Pose Estimation from a Single Depth Image
Depth Estimation,83,DeepTAM: Deep Tracking and Mapping
Depth Estimation,84,Self-Supervised 3D Keypoint Learning for Ego-motion Estimation
Depth Estimation,85,Fast Scene Understanding for Autonomous Driving
Depth Estimation,86,NerfingMVS: Guided Optimization of Neural Radiance Fields for Indoor Multi-view Stereo
Depth Estimation,87,DeepLiDAR: Deep Surface Normal Guided Depth Prediction for Outdoor Scene from Sparse LiDAR Data and Single Color Image
Depth Estimation,88,Self-Supervised Monocular Scene Flow Estimation
Depth Estimation,89,DF-Net: Unsupervised Joint Learning of Depth and Flow using Cross-Task Consistency
Depth Estimation,90,Objects are Different: Flexible Monocular 3D Object Detection
Depth Estimation,91,Ground-aware Monocular 3D Object Detection for Autonomous Driving
Depth Estimation,92,Towards Better Generalization: Joint Depth-Pose Learning without PoseNet
Depth Estimation,93,ClearGrasp: 3D Shape Estimation of Transparent Objects for Manipulation
Depth Estimation,94,Real-time single image depth perception in the wild with handheld devices
Depth Estimation,95,Towards real-time unsupervised monocular depth estimation on CPU
Depth Estimation,96,T2Net: Synthetic-to-Realistic Translation for Solving Single-Image Depth Estimation Tasks
Depth Estimation,97,ViP-DeepLab: Learning Visual Perception with Depth-aware Video Panoptic Segmentation
Depth Estimation,98,Fast-MVSNet: Sparse-to-Dense Multi-View Stereo With Learned Propagation and Gauss-Newton Refinement
Depth Estimation,99,HR-Depth: High Resolution Self-Supervised Monocular Depth Estimation
Depth Estimation,100,Categorical Depth Distribution Network for Monocular 3D Object Detection
Depth Estimation,101,Real-Time Joint Semantic Segmentation and Depth Estimation Using Asymmetric Annotations
Depth Estimation,102,Monocular Depth Estimation using Multi-Scale Continuous CRFs as Sequential Deep Networks
Depth Estimation,103,Multi-Scale Continuous CRFs as Sequential Deep Networks for Monocular Depth Estimation
Depth Estimation,104,On the uncertainty of self-supervised monocular depth estimation
Depth Estimation,105,Self-Supervised Monocular Depth Hints
Depth Estimation,106,Single Image Depth Prediction with Wavelet Decomposition
Depth Estimation,107,Non-Local Spatial Propagation Network for Depth Completion
Depth Estimation,108,Feature-metric Loss for Self-supervised Learning of Depth and Egomotion
Depth Estimation,109,Robust Learning Through Cross-Task Consistency
Depth Estimation,110,Robust Learning Through Cross-Task Consistency
Depth Estimation,111,Improving Semi-Supervised and Domain-Adaptive Semantic Segmentation with Self-Supervised Depth Estimation
Depth Estimation,112,Three Ways to Improve Semantic Segmentation with Self-Supervised Depth Estimation
Depth Estimation,113,Real Time Dense Depth Estimation by Fusing Stereo with Sparse Depth Measurements
Depth Estimation,114,End-to-End Pseudo-LiDAR for Image-Based 3D Object Detection
Depth Estimation,115,MINE: Towards Continuous Depth MPI with NeRF for Novel View Synthesis
Depth Estimation,116,Bi-Real Net: Binarizing Deep Network Towards Real-Network Performance
Depth Estimation,117,Fast Neural Architecture Search of Compact Semantic Segmentation Models via Auxiliary Cells
Depth Estimation,118,Auxiliary Tasks in Multi-task Learning
Depth Estimation,119,Joint Voxel and Coordinate Regression for Accurate 3D Facial Landmark Localization
Depth Estimation,120,Bi3D: Stereo Depth Estimation via Binary Classifications
Depth Estimation,121,Multi-View Silhouette and Depth Decomposition for High Resolution 3D Object Representation
Depth Estimation,122,360SD-Net: 360° Stereo Depth Estimation with Learnable Cost Volume
Depth Estimation,123,Monocular 3D Object Detection with Pseudo-LiDAR Point Cloud
Depth Estimation,124,Self-Supervised Monocular Depth Estimation: Solving the Dynamic Object Problem by Semantic Guidance
Depth Estimation,125,Dynamic Filter Networks
Depth Estimation,126,Real-Time Monocular Depth Estimation Using Synthetic Data With Domain Adaptation via Image Style Transfer
Depth Estimation,127,Is Pseudo-Lidar needed for Monocular 3D Object detection?
Depth Estimation,128,Structure-Guided Ranking Loss for Single Image Depth Prediction
Depth Estimation,129,DETR3D: 3D Object Detection from Multi-view Images via 3D-to-2D Queries
Depth Estimation,130,Holopix50k: A Large-Scale In-the-wild Stereo Image Dataset
Depth Estimation,131,Virtual Normal: Enforcing Geometric Constraints for Accurate and Robust Depth Prediction
Depth Estimation,132,UnOS: Unified Unsupervised Optical-Flow and Stereo-Depth Estimation by Watching Videos
Depth Estimation,133,Upgrading Optical Flow to 3D Scene Flow Through Optical Expansion
Depth Estimation,134,Visualization of Convolutional Neural Networks for Monocular Depth Estimation
Depth Estimation,135,"Unsupervised Depth Estimation, 3D Face Rotation and Replacement"
Depth Estimation,136,SharpNet: Fast and Accurate Recovery of Occluding Contours in Monocular Depth Estimation
Depth Estimation,137,Geometry-Aware Symmetric Domain Adaptation for Monocular Depth Estimation
Depth Estimation,138,"Predicting Depth, Surface Normals and Semantic Labels with a Common Multi-Scale Convolutional Architecture"
Depth Estimation,139,DeepVideoMVS: Multi-View Stereo on Video with Recurrent Spatio-Temporal Fusion
Depth Estimation,140,Unsupervised Adversarial Depth Estimation using Cycled Generative Networks
Depth Estimation,141,Learning monocular depth estimation infusing traditional stereo knowledge
Depth Estimation,142,Visibility-aware Multi-view Stereo Network
Depth Estimation,143,BiFuse: Monocular 360 Depth Estimation via Bi-Projection Fusion
Depth Estimation,144,Flow-Motion and Depth Network for Monocular Stereo and Beyond
Depth Estimation,145,Learning to Synthesize a 4D RGBD Light Field from a Single Image
Depth Estimation,146,Indoor Depth Completion with Boundary Consistency and Self-Attention
Depth Estimation,147,Structured Attention Guided Convolutional Neural Fields for Monocular Depth Estimation
Depth Estimation,148,Learning optical flow from still images
Depth Estimation,149,P²Net: Patch-match and Plane-regularization for Unsupervised Indoor Depth Estimation
Depth Estimation,150,P$^{2}$Net: Patch-match and Plane-regularization for Unsupervised Indoor Depth Estimation
Depth Estimation,151,Transformer-Based Attention Networks for Continuous Pixel-Wise Prediction
Depth Estimation,152,S2R-DepthNet: Learning a Generalizable Depth-specific Structural Representation
Depth Estimation,153,Monocular Depth Estimation Using Laplacian Pyramid-Based Depth Residuals
Depth Estimation,154,Geometry meets semantics for semi-supervised monocular depth estimation
Depth Estimation,155,StructDepth: Leveraging the structural regularities for self-supervised indoor depth estimation
Depth Estimation,156,Planar Prior Assisted PatchMatch Multi-View Stereo
Depth Estimation,157,Deep Depth from Defocus: how can defocus blur improve 3D estimation using dense neural networks?
Depth Estimation,158,Predicting Sharp and Accurate Occlusion Boundaries in Monocular Depth Estimation Using Displacement Fields
Depth Estimation,159,Single Image Depth Estimation Trained via Depth from Defocus Cues
Depth Estimation,160,CAM-Convs: Camera-Aware Multi-Scale Convolutions for Single-View Depth
Depth Estimation,161,Learning Monocular Depth by Distilling Cross-domain Stereo Networks
Depth Estimation,162,Spherical View Synthesis for Self-Supervised 360 Depth Estimation
Depth Estimation,163,Semi-Supervised Monocular Depth Estimation with Left-Right Consistency Using Deep Neural Network
Depth Estimation,164,UnrealROX: An eXtremely Photorealistic Virtual Reality Environment for Robotics Simulations and Synthetic Data Generation
Depth Estimation,165,OmniDepth: Dense Depth Estimation for Indoors Spherical Panoramas
Depth Estimation,166,Unsupervised Depth Learning in Challenging Indoor Video: Weak Rectification to Rescue
Depth Estimation,167,DELTAS: Depth Estimation by Learning Triangulation And densification of Sparse points
Depth Estimation,168,Structure-Aware Residual Pyramid Network for Monocular Depth Estimation
Depth Estimation,169,Attention-based Context Aggregation Network for Monocular Depth Estimation
Depth Estimation,170,EndoSLAM Dataset and An Unsupervised Monocular Visual Odometry and Depth Estimation Approach for Endoscopic Videos: Endo-SfMLearner
Depth Estimation,171,Dense Depth Estimation in Monocular Endoscopy with Self-supervised Learning Methods
Depth Estimation,172,Learning Unsupervised Multi-View Stereopsis via Robust Photometric Consistency
Depth Estimation,173,GeoNet++: Iterative Geometric Neural Network with Edge-Aware Refinement for Joint Depth and Surface Normal Estimation
Depth Estimation,174,GeoNet: Geometric Neural Network for Joint Depth and Surface Normal Estimation
Depth Estimation,175,Wasserstein Distances for Stereo Disparity Estimation
Depth Estimation,176,Decoder Modulation for Indoor Depth Completion
Depth Estimation,177,Learning to Adapt for Stereo
Depth Estimation,178,LCD: Learned Cross-Domain Descriptors for 2D-3D Matching
Depth Estimation,179,Single-Image Depth Perception in the Wild
Depth Estimation,180,EPINET: A Fully-Convolutional Neural Network Using Epipolar Geometry for Depth from Light Field Images
Depth Estimation,181,Pyramid Multi-view Stereo Net with Self-adaptive View Aggregation
Depth Estimation,182,Learning Non-Volumetric Depth Fusion Using Successive Reprojections
Depth Estimation,183,Learning Monocular Dense Depth from Events
Depth Estimation,184,IDA-3D: Instance-Depth-Aware 3D Object Detection From Stereo Vision for Autonomous Driving
Depth Estimation,185,"Student Becoming the Master: Knowledge Amalgamation for Joint Scene Parsing, Depth Estimation, and More"
Depth Estimation,186,Excavating the Potential Capacity of Self-Supervised Monocular Depth Estimation
Depth Estimation,187,Generalizable Data-free Objective for Crafting Universal Adversarial Perturbations
Depth Estimation,188,Unsupervised Learning of Monocular Depth and Ego-Motion Using Multiple Masks
Depth Estimation,189,"Unsupervised Learning of Depth, Optical Flow and Pose with Occlusion from 3D Geometry"
Depth Estimation,190,Style Augmentation: Data Augmentation via Style Randomization
Depth Estimation,191,SeGAN: Segmenting and Generating the Invisible
Depth Estimation,192,HoHoNet: 360 Indoor Holistic Understanding with Latent Horizontal Features
Depth Estimation,193,M4Depth: A motion-based approach for monocular depth estimation on video sequences
Depth Estimation,194,Depth Estimation from Monocular Images and Sparse Radar Data
Depth Estimation,195,Single-Image Depth Prediction Makes Feature Matching Easier
Depth Estimation,196,LED2-Net: Monocular 360 Layout Estimation via Differentiable Depth Rendering
Depth Estimation,197,M3DSSD: Monocular 3D Single Stage Object Detector
Depth Estimation,198,Single-Image Depth Prediction Makes Feature Matching Easier
Depth Estimation,199,Hard Pixel Mining for Depth Privileged Semantic Segmentation
Depth Estimation,200,Multi-view Depth Estimation using Epipolar Spatio-Temporal Networks
Optical Character Recognition,1,Attention-based Extraction of Structured Information from Street View Imagery
Optical Character Recognition,2,TrOCR: Transformer-based Optical Character Recognition with Pre-trained Models
Optical Character Recognition,3,Adapting the Tesseract Open Source OCR Engine for Multilingual OCR
Optical Character Recognition,4,PP-OCRv2: Bag of Tricks for Ultra Lightweight OCR System
Optical Character Recognition,5,PP-OCR: A Practical Ultra Lightweight OCR System
Optical Character Recognition,6,LayoutReader: Pre-training of Text and Layout for Reading Order Detection
Optical Character Recognition,7,Chinese Text in the Wild
Optical Character Recognition,8,End-to-End Interpretation of the French Street Name Signs Dataset
Optical Character Recognition,9,COCO-Text: Dataset and Benchmark for Text Detection and Recognition in Natural Images
Optical Character Recognition,10,"MMOCR: A Comprehensive Toolbox for Text Detection, Recognition and Understanding"
Optical Character Recognition,11,License Plate Detection and Recognition in Unconstrained Scenarios
Optical Character Recognition,12,Image-to-Markup Generation with Coarse-to-Fine Attention
Optical Character Recognition,13,ASTER: An Attentional Scene Text Recognizer with Flexible Rectification
Optical Character Recognition,14,STN-OCR: A single Neural Network for Text Detection and Text Recognition
Optical Character Recognition,15,Rosetta: Large scale system for text detection and recognition in images
Optical Character Recognition,16,PICK: Processing Key Information Extraction from Documents using Improved Graph Learning-Convolutional Networks
Optical Character Recognition,17,Exploring Cross-Image Pixel Contrast for Semantic Segmentation
Optical Character Recognition,18,DewarpNet: Single-Image Document Unwarping With Stacked 3D and 2D Regression Networks
Optical Character Recognition,19,E2E-MLT - an Unconstrained End-to-End Method for Multi-Language Scene Text
Optical Character Recognition,20,An Unsupervised Model of Orthographic Variation for Historical Document Transcription
Optical Character Recognition,21,Document Rectification and Illumination Correction using a Patch-based CNN
Optical Character Recognition,22,"Image-based table recognition: data, model, and evaluation"
Optical Character Recognition,23,"Lights, Camera, Action! A Framework to Improve NLP Accuracy over OCR documents"
Optical Character Recognition,24,The Newspaper Navigator Dataset: Extracting And Analyzing Visual Content from 16 Million Historic Newspaper Pages in Chronicling America
Optical Character Recognition,25,ScrabbleGAN: Semi-Supervised Varying Length Handwritten Text Generation
Optical Character Recognition,26,PDFAnno: a Web-based Linguistic Annotation Tool for PDF Documents
