area,rank,title
Denoising,75,LAPAR: Linearly-Assembled Pixel-Adaptive Regression Network for Single Image Super-Resolution and Beyond
Denoising,76,Real-world Noisy Image Denoising: A New Benchmark
Denoising,77,Multi-level Wavelet-CNN for Image Restoration
Denoising,78,Anomaly Detection with Robust Deep Autoencoders
Denoising,79,Variational Image Restoration Network
Denoising,80,Variational Denoising Network: Toward Blind Noise Modeling and Removal
Denoising,81,Unsupervised Learning with Stein's Unbiased Risk Estimator
Denoising,82,Learned D-AMP: Principled Neural Network based Compressive Image Recovery
Denoising,83,From Denoising to Compressed Sensing
Denoising,84,Multi-level Wavelet Convolutional Neural Networks
Denoising,85,ViDeNN: Deep Blind Video Denoising
Denoising,86,Opportunities and Challenges of Deep Learning Methods for Electrocardiogram Data: A Systematic Review
Denoising,87,Educating Text Autoencoders: Latent Representation Guidance via Denoising
Denoising,88,Generating Classification Weights with GNN Denoising Autoencoders for Few-Shot Learning
Denoising,89,Image Reconstruction with Predictive Filter Flow
Denoising,90,Stochastic Frequency Masking to Improve Super-Resolution and Denoising Networks
Denoising,91,Learning Spatial and Spatio-Temporal Pixel Aggregations for Image and Video Denoising
Denoising,92,Joint Optimization of Masks and Deep Recurrent Neural Networks for Monaural Source Separation
Denoising,93,Face De-Spoofing: Anti-Spoofing via Noise Modeling
Denoising,94,Dual Adversarial Network: Toward Real-world Noise Removal and Noise Generation
Denoising,95,MEMC-Net: Motion Estimation and Motion Compensation Driven Neural Network for Video Frame Interpolation and Enhancement
Denoising,96,MEMC-Net: Motion Estimation and Motion Compensation Driven Neural Network for Video Interpolation and Enhancement
Denoising,97,Multi-Kernel Prediction Networks for Denoising of Burst Images
Denoising,98,PointCleanNet: Learning to Denoise and Remove Outliers from Dense Point Clouds
Denoising,99,Contrastive Principal Component Analysis
Denoising,100,Supervised Raw Video Denoising with a Benchmark Dataset on Dynamic Scenes
Denoising,101,Denoising IMU Gyroscopes with Deep Learning for Open-Loop Attitude Estimation
Denoising,102,CURL: Neural Curve Layers for Global Image Enhancement
Denoising,103,Self-Supervised Deep Depth Denoising
Denoising,104,Action-Conditioned 3D Human Motion Synthesis with Transformer VAE
Denoising,105,Unpaired Learning of Deep Image Denoising
Denoising,106,Attention Guided Low-light Image Enhancement with a Large Scale Low-light Simulation Dataset
Denoising,107,Adversarial score matching and improved sampling for image generation
Denoising,108,Deterministic Non-Autoregressive Neural Sequence Modeling by Iterative Refinement
Denoising,109,EDCNN: Edge enhancement-based Densely Connected Network with Compound Loss for Low-Dose CT Denoising
Denoising,110,Intermediate Layer Optimization for Inverse Problems using Deep Generative Models
Denoising,111,PixelRL: Fully Convolutional Network with Reinforcement Learning for Image Processing
Denoising,112,Fully Convolutional Network with Multi-Step Reinforcement Learning for Image Processing
Denoising,113,Invertible Denoising Network: A Light Solution for Real Noise Removal
Denoising,114,Unsupervised Real Image Super-Resolution via Generative Variational AutoEncoder
Denoising,115,NeRV: Neural Representations for Videos
Denoising,116,RoQNN: Noise-Aware Training for Robust Quantum Neural Networks
Denoising,117,Deep Learning-Based Channel Estimation
Denoising,118,Connecting Image Denoising and High-Level Vision Tasks via Deep Learning
Denoising,119,Sharpness-aware Low dose CT denoising using conditional generative adversarial network
Denoising,120,When Image Denoising Meets High-Level Vision Tasks: A Deep Learning Approach
Denoising,121,Learning Deformable Kernels for Image and Video Denoising
Denoising,122,Spatial-Adaptive Network for Single Image Denoising
Denoising,123,Dense xUnit Networks
Denoising,124,xUnit: Learning a Spatial Activation Function for Efficient Image Restoration
Denoising,125,The Little Engine that Could: Regularization by Denoising (RED)
Denoising,126,Neighbor2Neighbor: Self-Supervised Denoising from Single Noisy Images
Denoising,127,Toward Spatially Unbiased Generative Models
Denoising,128,HiFi-GAN: High-Fidelity Denoising and Dereverberation Based on Speech Deep Features in Adversarial Networks
Denoising,129,Non-Local Video Denoising by CNN
Denoising,130,Iterative Joint Image Demosaicking and Denoising using a Residual Denoising Network
Denoising,131,Deep Image Demosaicking using a Cascade of Convolutional Residual Denoising Networks
Denoising,132,On-Demand Learning for Deep Image Restoration
Denoising,133,"Show, Edit and Tell: A Framework for Editing Image Captions"
Denoising,134,Visual Speech Enhancement Without A Real Visual Stream
Denoising,135,Lite Audio-Visual Speech Enhancement
Denoising,136,Deep Graph-Convolutional Image Denoising
Denoising,137,Image Denoising with Graph-Convolutional Neural Networks
Denoising,138,Diff-TTS: A Denoising Diffusion Model for Text-to-Speech
Denoising,139,G-SimCLR: Self-Supervised Contrastive Learning with Guided Projection via Pseudo Labelling
Denoising,140,G-SimCLR : Self-Supervised Contrastive Learning with Guided Projection via Pseudo Labelling
Denoising,141,TTS-Portuguese Corpus: a corpus for speech synthesis in Brazilian Portuguese
Denoising,142,Deep Decoder: Concise Image Representations from Untrained Non-convolutional Networks
Denoising,143,Score-Based Point Cloud Denoising
Denoising,144,Differentiable Manifold Reconstruction for Point Cloud Denoising
Denoising,145,Transfer Learning from Synthetic to Real-Noise Denoising with Adaptive Instance Normalization
Denoising,146,"Deep Hyperspectral Prior: Denoising, Inpainting, Super-Resolution"
Denoising,147,Learning Raw Image Denoising with Bayer Pattern Unification and Bayer Preserving Augmentation
Denoising,148,Low Dose CT Image Denoising Using a Generative Adversarial Network with Wasserstein Distance and Perceptual Loss
Denoising,149,Unified Pre-training for Program Understanding and Generation
Denoising,150,NBNet: Noise Basis Learning for Image Denoising with Subspace Projection
Denoising,151,One Model to Reconstruct Them All: A Novel Way to Use the Stochastic Noise in StyleGAN
Denoising,152,Anatomical Priors for Image Segmentation via Post-Processing with Denoising Autoencoders
Denoising,153,Co-Separating Sounds of Visual Objects
Denoising,154,A Poisson-Gaussian Denoising Dataset with Real Fluorescence Microscopy Images
Denoising,155,Generating Training Data for Denoising Real RGB Images via Camera Pipeline Simulation
Denoising,156,CPT: A Pre-Trained Unbalanced Transformer for Both Chinese Language Understanding and Generation
Denoising,157,ILVR: Conditioning Method for Denoising Diffusion Probabilistic Models
Denoising,158,DVDnet: A Fast Network for Deep Video Denoising
Denoising,159,Decouple Learning for Parameterized Image Operators
Denoising,160,Backpropagation-Friendly Eigendecomposition
Denoising,161,Deep learning cardiac motion analysis for human survival prediction
Denoising,162,HDRUNet: Single Image HDR Reconstruction with Denoising and Dequantization
Denoising,163,A Flexible Framework for Designing Trainable Priors with Adaptive Smoothing and Game Encoding
Denoising,164,Fully Trainable and Interpretable Non-Local Sparse Models for Image Restoration
Denoising,165,Noise2Same: Optimizing A Self-Supervised Bound for Image Denoising
Denoising,166,Multimodal Autoencoder: A Deep Learning Approach to Filling In Missing Sensor Data and Enabling Better Mood Prediction
Denoising,167,A Bayesian Perspective on the Deep Image Prior
Denoising,168,Deep Convolutional Framelet Denosing for Low-Dose CT via Wavelet Residual Network
Denoising,169,Deep Convolutional Dictionary Learning for Image Denoising
Denoising,170,Plug-and-Play Methods Provably Converge with Properly Trained Denoisers
Denoising,171,Noisy-As-Clean: Learning Self-supervised Denoising from the Corrupted Image
Denoising,172,Neural NILM: Deep Neural Networks Applied to Energy Disaggregation
Denoising,173,TFPnP: Tuning-free Plug-and-Play Proximal Algorithm with Applications to Inverse Imaging Problems
Denoising,174,Tuning-free Plug-and-Play Proximal Algorithm for Inverse Imaging Problems
Denoising,175,Probabilistic Noise2Void: Unsupervised Content-Aware Denoising
Denoising,176,Missing Data Imputation with Adversarially-trained Graph Convolutional Networks
Denoising,177,Learning to Separate Object Sounds by Watching Unlabeled Video
Denoising,178,Deep Reparametrization of Multi-Frame Super-Resolution and Denoising
Denoising,179,Noise Robust Generative Adversarial Networks
Denoising,180,Classifier and Exemplar Synthesis for Zero-Shot Learning
Denoising,181,Dynamic Attentive Graph Learning for Image Restoration
Denoising,182,DHP: Differentiable Meta Pruning via HyperNetworks
Denoising,183,Self-Guided Network for Fast Image Denoising
Denoising,184,SPINE: SParse Interpretable Neural Embeddings
Denoising,185,Beyond Deep Residual Learning for Image Restoration: Persistent Homology-Guided Manifold Simplification
Denoising,186,Pyramid Real Image Denoising Network
Denoising,187,Unsupervised Sentence Compression using Denoising Auto-Encoders
Denoising,188,Learning an Adaptive Model for Extreme Low-light Raw Image Processing
Denoising,189,Learning from Rules Generalizing Labeled Exemplars
Denoising,190,Hierarchical Relational Networks for Group Activity Recognition and Retrieval
Denoising,191,Hyperspectral Image Denoising Employing a Spatial-Spectral Deep Residual Convolutional Neural Network
Denoising,192,Total Denoising: Unsupervised Learning of 3D Point Cloud Cleaning
Denoising,193,BiO-Net: Learning Recurrent Bi-directional Connections for Encoder-Decoder Architecture
Denoising,194,3D Quasi-Recurrent Neural Network for Hyperspectral Image Denoising
Denoising,195,ColorFool: Semantic Adversarial Colorization
Denoising,196,LIDIA: Lightweight Learned Image Denoising with Instance Adaptation
Denoising,197,Simultaneous Fidelity and Regularization Learning for Image Restoration
Denoising,198,RF-Based Direction Finding of UAVs Using DNN
Denoising,199,Denoising Adversarial Autoencoders
Denoising,200,SinIR: Efficient General Image Manipulation with Single Image Reconstruction
Super-Resolution,1,Photo-Realistic Single Image Super-Resolution Using a Generative Adversarial Network
Super-Resolution,2,Image Super-Resolution Using Deep Convolutional Networks
Super-Resolution,3,COMISR: Compression-Informed Video Super-Resolution
Super-Resolution,4,Real-Time Single Image and Video Super-Resolution Using an Efficient Sub-Pixel Convolutional Neural Network
Super-Resolution,5,Perceptual Losses for Real-Time Style Transfer and Super-Resolution
Super-Resolution,6,ESRGAN: Enhanced Super-Resolution Generative Adversarial Networks
Super-Resolution,7,Deep Image Prior
Super-Resolution,8,Real-ESRGAN: Training Real-World Blind Super-Resolution with Pure Synthetic Data
Super-Resolution,9,PULSE: Self-Supervised Photo Upsampling via Latent Space Exploration of Generative Models
Super-Resolution,10,DeFMO: Deblurring and Shape Recovery of Fast Moving Objects
Super-Resolution,11,Learning Temporal Coherence via Self-Supervision for GAN-based Video Generation
Super-Resolution,12,Residual Dense Network for Image Super-Resolution
Super-Resolution,13,SinGAN: Learning a Generative Model from a Single Natural Image
Super-Resolution,14,BasicVSR: The Search for Essential Components in Video Super-Resolution and Beyond
Super-Resolution,15,Recovering Realistic Texture in Image Super-resolution by Deep Spatial Feature Transform
Super-Resolution,16,BasicVSR++: Improving Video Super-Resolution with Enhanced Propagation and Alignment
Super-Resolution,17,EDVR: Video Restoration with Enhanced Deformable Convolutional Networks
Super-Resolution,18,A Unified Neural Architecture for Instrumental Audio Tasks
Super-Resolution,19,Deep Back-Projection Networks For Super-Resolution
Super-Resolution,20,Enhanced Deep Residual Networks for Single Image Super-Resolution
Super-Resolution,21,CogView: Mastering Text-to-Image Generation via Transformers
Super-Resolution,22,A Tour of Convolutional Networks Guided by Linear Interpreters
Super-Resolution,23,Wide Activation for Efficient and Accurate Image Super-Resolution
Super-Resolution,24,AIM 2020 Challenge on Efficient Super-Resolution: Methods and Results
Super-Resolution,25,Image Super-Resolution Using Very Deep Residual Channel Attention Networks
Super-Resolution,26,Beyond a Gaussian Denoiser: Residual Learning of Deep CNN for Image Denoising
Super-Resolution,27,cGANs with Projection Discriminator
Super-Resolution,28,GIMP-ML: Python Plugins for using Computer Vision Models in GIMP
Super-Resolution,29,A Comprehensive guide to Bayesian Convolutional Neural Network with Variational Inference
Super-Resolution,30,Lossless Image Compression through Super-Resolution
Super-Resolution,31,Deep Plug-and-Play Super-Resolution for Arbitrary Blur Kernels
Super-Resolution,32,Universally Slimmable Networks and Improved Training Techniques
Super-Resolution,33,Learning Continuous Image Representation with Local Implicit Image Function
Super-Resolution,34,Image Restoration Using Convolutional Auto-encoders with Symmetric Skip Connections
Super-Resolution,35,Zooming SlowMo: An Efficient One-Stage Framework for Space-Time Video Super-Resolution
Super-Resolution,36,Zooming Slow-Mo: Fast and Accurate One-Stage Space-Time Video Super-Resolution
Super-Resolution,37,SRFlow: Learning the Super-Resolution Space with Normalizing Flow
Super-Resolution,38,Fourier Neural Operator for Parametric Partial Differential Equations
Super-Resolution,39,Fast and Accurate Image Super Resolution by Deep CNN with Skip Connection and Network in Network
Super-Resolution,40,"Fast, Accurate and Lightweight Super-Resolution with Neural Architecture Search"
Super-Resolution,41,SwinIR: Image Restoration Using Swin Transformer
Super-Resolution,42,Temporal FiLM: Capturing Long-Range Sequence Dependencies with Feature-Wise Modulations.
Super-Resolution,43,Audio Super Resolution using Neural Networks
Super-Resolution,44,Real-Time Super-Resolution System of 4K-Video Based on Deep Learning
Super-Resolution,45,Deep Unfolding Network for Image Super-Resolution
Super-Resolution,46,CNN-generated images are surprisingly easy to spot... for now
Super-Resolution,47,Learning Texture Transformer Network for Image Super-Resolution
Super-Resolution,48,Real-World Super-Resolution via Kernel Estimation and Noise Injection
Super-Resolution,49,NTIRE 2020 Challenge on Real-World Image Super-Resolution: Methods and Results
Super-Resolution,50,Feedback Network for Image Super-Resolution
Super-Resolution,51,AtlasNet: A Papier-Mâché Approach to Learning 3D Surface Generation
Super-Resolution,52,Deep Back-Projection Networks for Single Image Super-resolution
Super-Resolution,53,The 2018 PIRM Challenge on Perceptual Image Super-resolution
Super-Resolution,54,Second-Order Attention Network for Single Image Super-Resolution
Super-Resolution,55,Invertible Image Rescaling
Super-Resolution,56,Meta-SR: A Magnification-Arbitrary Network for Super-Resolution
Super-Resolution,57,Residual Dense Network for Image Restoration
Super-Resolution,58,Maintaining Natural Image Statistics with the Contextual Loss
Super-Resolution,59,Recurrent Back-Projection Network for Video Super-Resolution
Super-Resolution,60,Designing a Practical Degradation Model for Deep Blind Image Super-Resolution
Super-Resolution,61,Image Super-Resolution by Neural Texture Transfer
Super-Resolution,62,Learning Enriched Features for Real Image Restoration and Enhancement
Super-Resolution,63,Closed-loop Matters: Dual Regression Networks for Single Image Super-Resolution
Super-Resolution,64,Sparse-to-Dense: Depth Prediction from Sparse Depth Samples and a Single Image
Super-Resolution,65,Learning a Single Convolutional Super-Resolution Network for Multiple Degradations
Super-Resolution,66,Recurrent Transition Networks for Character Locomotion
Super-Resolution,67,Structure-Preserving Image Super-Resolution
Super-Resolution,68,Structure-Preserving Super Resolution with Gradient Guidance
Super-Resolution,69,Video Enhancement with Task-Oriented Flow
Super-Resolution,70,Learned Image Downscaling for Upscaling using Content Adaptive Resampler
Super-Resolution,71,"""Zero-Shot"" Super-Resolution using Deep Internal Learning"
Super-Resolution,72,TDAN: Temporally-Deformable Alignment Network for Video Super-Resolution
Super-Resolution,73,TDAN: Temporally Deformable Alignment Network for Video Super-Resolution
Super-Resolution,74,Image Super-Resolution with Cross-Scale Non-Local Attention and Exhaustive Self-Exemplars Mining
Super-Resolution,75,Rethinking Data Augmentation for Image Super-resolution: A Comprehensive Analysis and a New Strategy
Super-Resolution,76,Pyramid Attention Networks for Image Restoration
Super-Resolution,77,"Fast, Accurate, and Lightweight Super-Resolution with Cascading Residual Network"
Super-Resolution,78,Residual Non-local Attention Networks for Image Restoration
Super-Resolution,79,iSeeBetter: Spatio-Temporal Video Super Resolution using Recurrent-Generative Back-Projection Networks
Super-Resolution,80,iSeeBetter: Spatio-temporal video super-resolution using recurrent generative back-projection networks
Super-Resolution,81,Deep Learning for Image Super-resolution: A Survey
Super-Resolution,82,Learning Parallax Attention for Stereo Image Super-Resolution
Super-Resolution,83,Plug-and-Play Image Restoration with Deep Denoiser Prior
Super-Resolution,84,AIM 2019 Challenge on Constrained Super-Resolution: Methods and Results
Super-Resolution,85,Lightweight Image Super-Resolution with Information Multi-distillation Network
Super-Resolution,86,Neural Nearest Neighbors Networks
Super-Resolution,87,Handheld Multi-Frame Super-Resolution
Super-Resolution,88,Blind Super-Resolution Kernel Estimation using an Internal-GAN
Super-Resolution,89,Real-World Single Image Super-Resolution: A Brief Review
Super-Resolution,90,"Zoom To Learn, Learn To Zoom"
Super-Resolution,91,Detail-revealing Deep Video Super-resolution
Super-Resolution,92,Image Super-Resolution via Iterative Refinement
Super-Resolution,93,Deep Face Super-Resolution with Iterative Collaboration between Attentive Recovery and Landmark Estimation
Super-Resolution,94,FSRNet: End-to-End Learning Face Super-Resolution with Facial Priors
Super-Resolution,95,Multi-scale Residual Network for Image Super-Resolution
Super-Resolution,96,Cross-Scale Internal Graph Neural Network for Image Super-Resolution
Super-Resolution,97,RankSRGAN: Generative Adversarial Networks with Ranker for Image Super-Resolution
Super-Resolution,98,HighRes-net: Recursive Fusion for Multi-Frame Super-Resolution of Satellite Imagery
Super-Resolution,99,HighRes-net: Multi-Frame Super-Resolution by Recursive Fusion
Super-Resolution,100,Neural Radiance Flow for 4D View Synthesis and Video Processing
Super-Resolution,101,Meta-Transfer Learning for Zero-Shot Super-Resolution
Super-Resolution,102,Image Super-Resolution via Deep Recursive Residual Network
Super-Resolution,103,Efficient Image Super-Resolution Using Pixel Attention
Super-Resolution,104,Enhanced Quadratic Video Interpolation
Super-Resolution,105,Progressive Face Super-Resolution via Attention to Facial Landmark
Super-Resolution,106,Learning Spatial-Spectral Prior for Super-Resolution of Hyperspectral Imagery
Super-Resolution,107,Unsupervised Degradation Representation Learning for Blind Super-Resolution
Super-Resolution,108,ClassSR: A General Framework to Accelerate Super-Resolution Networks by Data Characteristic
Super-Resolution,109,Scene Text Image Super-Resolution in the Wild
Super-Resolution,110,Deformable 3D Convolution for Video Super-Resolution
Super-Resolution,111,Deep Video Super-Resolution Network Using Dynamic Upsampling Filters Without Explicit Motion Compensation
Super-Resolution,112,The Perception-Distortion Tradeoff
Super-Resolution,113,Creating High Resolution Images with a Latent Adversarial Generator
Super-Resolution,114,"To learn image super-resolution, use a GAN to learn how to do image degradation first"
Super-Resolution,115,Residual Feature Distillation Network for Lightweight Image Super-Resolution
Super-Resolution,116,Pre-Trained Image Processing Transformer
Super-Resolution,117,Unsupervised Image-to-Image Translation via Pre-trained StyleGAN2 Network
Super-Resolution,118,"Rethinking the Pipeline of Demosaicing, Denoising and Super-Resolution"
Super-Resolution,119,Blind Super-Resolution With Iterative Kernel Correction
Super-Resolution,120,MemNet: A Persistent Memory Network for Image Restoration
Super-Resolution,121,Non-Local Recurrent Network for Image Restoration
Super-Resolution,122,Video Super-Resolution Transformer
Super-Resolution,123,Modulating Image Restoration with Continual Levels via Adaptive Feature Modification Layers
Super-Resolution,124,End-to-end Alternating Optimization for Blind Super Resolution
Super-Resolution,125,Unfolding the Alternating Optimization for Blind Super Resolution
Super-Resolution,126,Space-Time-Aware Multi-Resolution Video Enhancement
Super-Resolution,127,Exploring Sparsity in Image Super-Resolution for Efficient Inference
Super-Resolution,128,Camera Lens Super-Resolution
Super-Resolution,129,LAPAR: Linearly-Assembled Pixel-Adaptive Regression Network for Single Image Super-Resolution and Beyond
Super-Resolution,130,Best-Buddy GANs for Highly Detailed Image Super-Resolution
Super-Resolution,131,MuCAN: Multi-Correspondence Aggregation Network for Video Super-Resolution
Super-Resolution,132,Multi-level Wavelet-CNN for Image Restoration
Super-Resolution,133,Lightweight image super-resolution with enhanced CNN
Super-Resolution,134,Variational Image Restoration Network
Super-Resolution,135,EnhanceNet: Single Image Super-Resolution Through Automated Texture Synthesis
Super-Resolution,136,Unsupervised Real-world Image Super Resolution via Domain-distance Aware Training
Super-Resolution,137,Frequency Separation for Real-World Super-Resolution
Super-Resolution,138,Multi-level Wavelet Convolutional Neural Networks
Super-Resolution,139,Lightweight Image Super-Resolution with Adaptive Weighted Learning Network
Super-Resolution,140,Learning A Single Network for Scale-Arbitrary Super-Resolution
Super-Resolution,141,Deep Video Super-Resolution using HR Optical Flow Estimation
Super-Resolution,142,Patch-based Progressive 3D Point Set Upsampling
Super-Resolution,143,Learning for Video Super-Resolution through HR Optical Flow Estimation
Super-Resolution,144,NU-Wave: A Diffusion Probabilistic Model for Neural Audio Upsampling
Super-Resolution,145,Learning Spatial Attention for Face Super-Resolution
Super-Resolution,146,"tempoGAN: A Temporally Coherent, Volumetric GAN for Super-resolution Fluid Flow"
Super-Resolution,147,Image Reconstruction with Predictive Filter Flow
Super-Resolution,148,Stochastic Frequency Masking to Improve Super-Resolution and Denoising Networks
Super-Resolution,149,Revisiting Temporal Modeling for Video Super-resolution
Super-Resolution,150,"3D Human Pose, Shape and Texture from Low-Resolution Images and Videos"
Super-Resolution,151,3D Human Shape and Pose from a Single Low-Resolution Image with Self-Supervised Learning
Super-Resolution,152,Small-Object Detection in Remote Sensing Images with End-to-End Edge-Enhanced GAN and Object Detector Network
Super-Resolution,153,Learning Structral coherence Via Generative Adversarial Network for Single Image Super-Resolution
Super-Resolution,154,Progressive Fusion Video Super-Resolution Network via Exploiting Non-Local Spatio-Temporal Correlations
Super-Resolution,155,Multi-View Silhouette and Depth Decomposition for High Resolution 3D Object Representation
Super-Resolution,156,Component Divide-and-Conquer for Real-World Image Super-Resolution
Super-Resolution,157,Multi-image Super Resolution of Remotely Sensed Images using Residual Feature Attention Deep Neural Networks
Super-Resolution,158,AIM 2019 Challenge on Real-World Image Super-Resolution: Methods and Results
Super-Resolution,159,MEMC-Net: Motion Estimation and Motion Compensation Driven Neural Network for Video Interpolation and Enhancement
Super-Resolution,160,MEMC-Net: Motion Estimation and Motion Compensation Driven Neural Network for Video Frame Interpolation and Enhancement
Super-Resolution,161,Fast and Efficient Image Quality Enhancement via Desubpixel Convolutional Neural Networks
Super-Resolution,162,Gated Fusion Network for Joint Image Deblurring and Super-Resolution
Super-Resolution,163,Holopix50k: A Large-Scale In-the-wild Stereo Image Dataset
Super-Resolution,164,Shepard Convolutional Neural Networks
Super-Resolution,165,Spatial-Angular Interaction for Light Field Image Super-Resolution
Super-Resolution,166,Spatial-Angular Interaction for Light Field Image Super-Resolution
Super-Resolution,167,Super-resolution of Sentinel-2 images: Learning a globally applicable deep neural network
Super-Resolution,168,Deeply-Recursive Convolutional Network for Image Super-Resolution
Super-Resolution,169,Brain MRI super-resolution using 3D generative adversarial networks
Super-Resolution,170,Natural and Realistic Single Image Super-Resolution with Explicit Natural Manifold Discrimination
Super-Resolution,171,Fast and Accurate Single Image Super-Resolution via Information Distillation Network
Super-Resolution,172,Progressive Perception-Oriented Network for Single Image Super-Resolution
Super-Resolution,173,Dual Super-Resolution Learning for Semantic Segmentation
Super-Resolution,174,Single Image Super-Resolution via a Holistic Attention Network
Super-Resolution,175,Robust Reference-based Super-Resolution via C2-Matching
Super-Resolution,176,Video Super-resolution with Temporal Group Attention
